{
  "ID": "example_es_0001",
  "Target": "Se los voy a devolver la semana que viene.",
  "NaturalMeaning": "I'm going to return them to you next week.",
  "Context": "A neutral way to say that you plan to return several things to someone next week.",
  "Chunks": [
    "se los",
    "voy a devolver",
    "la semana que viene"
  ],
  "Grammar": [
    {
      "form": "se + los",
      "function": "indirect-object pronoun followed by a direct-object pronoun",
      "meaning_in_sentence": "to you + them"
    },
    {
      "form": "ir a + infinitive",
      "function": "planned or near-future construction",
      "meaning_in_sentence": "am going to return"
    }
  ],
  "Vocabulary": [
    {
      "lemma": "devolver",
      "part_of_speech": "verb",
      "definition": "to give or take something back to the person or place it came from"
    }
  ],
  "Usage": "A common neutral way to express a planned future action.",
  "Pronunciation": "Keep the pronoun sequence and verb phrase connected rather than isolating every word.",
  "NaturalSpeech": "The sentence should flow in a few rhythmic groups, with light linking across word boundaries.",
  "Example": "Te lo voy a devolver mañana.",
  "OriginalInput": "Se los voy a devolver la semana que viene.",
  "CorrectionNote": "",
  "AudioNatural": "anki_example_es_0001_natural.wav",
  "AudioCareful": "anki_example_es_0001_careful.wav",
  "Image": "anki_example_es_0001_image.webp",
  "Tags": [
    "Spanish::A1",
    "Grammar::ObjectPronouns",
    "Grammar::NearFuture",
    "Source::UserInput"
  ],
  "Language": "es",
  "Dialect": "Peninsular Spanish",
  "Difficulty": "basic-intermediate",
  "Source": "UserInput",
  "ImageMode": "generate",
  "InputType": "sentence",
  "PartOfSpeech": null,
  "CardPolicy": {
    "comprehension": true,
    "listening": true,
    "production": false,
    "error_correction": false
  },
  "AudioProvider": "example-provider",
  "AudioModel": null
}
